{
  "id": "11742e0d-a182-49fa-a3e0-444e491af41e",
  "courseId": "course-001",
  "lectureId": "test-beginner",
  "presetId": "beginner-mode",
  "artifactType": "summary",
  "generatedAt": "2026-02-11T09:33:47.109866+00:00",
  "version": "0.2",
  "threadRefs": [
    "2c5e7d74-d171-4e8c-9dca-704c0ab9f42d",
    "b14644ae-ac3e-4093-ba7d-c94d03250d67",
    "02dcda68-b5ba-4465-9797-834087a28b27"
  ],
  "overview": "Plain-language recap focused on core intuition and examples.",
  "sections": [
    {
      "title": "Big idea",
      "bullets": [
        "Core concept from test-beginner: fundamental principles explained simply.",
        "Key mechanism: how the main process works in practice."
      ]
    },
    {
      "title": "Why it matters",
      "bullets": [
        "Practical applications and real-world relevance.",
        "Foundation for understanding advanced topics."
      ]
    }
  ]
}
