{
  "id": "375cdfd3-8ad9-43ef-bb2d-a1a179056a68",
  "courseId": "course-001",
  "lectureId": "test-research",
  "presetId": "research-mode",
  "artifactType": "summary",
  "generatedAt": "2026-02-11T09:33:59.940541+00:00",
  "version": "0.2",
  "threadRefs": [
    "2c5e7d74-d171-4e8c-9dca-704c0ab9f42d",
    "b14644ae-ac3e-4093-ba7d-c94d03250d67",
    "02dcda68-b5ba-4465-9797-834087a28b27"
  ],
  "overview": "Claim-focused summary with evidence placeholders.",
  "sections": [
    {
      "title": "Claims",
      "bullets": [
        "Primary mechanism depends on specific factors. [evidence]",
        "Key process increases efficiency. [evidence]"
      ]
    },
    {
      "title": "Open questions",
      "bullets": [
        "What experimental data best quantifies the main effect?",
        "How do secondary factors affect system stability?"
      ]
    }
  ]
}
